{"schema":"contrepoint/manifeste/1","contrat":"0.4.0","schemas":["contrepoint/preuve/1","contrepoint/instantane/1","contrepoint/eclat-preuves/1"],"date_arretee":"2026-08-27T00:00:00Z","licence":"Licence Ouverte / Open Licence (Etalab)","mention_paternite":"Assemblée nationale — Licence Ouverte v1.0 ; Chapel Hill Expert Survey — aucune licence publiée, citation exigée ; Ministère de l'intérieur — Licence Ouverte v2.0 — données du 2026-08-27","familles":[{"id":"votes","libelle":"Votes nominatifs","echelle":"votes_an17_ancre_v1","min":-1.0,"max":1.0,"decimales":2},{"id":"experts","libelle":"Enquête d'experts","echelle":"ches_lrgen_0_10","min":0.0,"max":10.0,"decimales":2},{"id":"administratif","libelle":"Nuance administrative","echelle":"nuance_leg2024","min":null,"max":null,"decimales":null}],"instantanes":[{"id":"an17-2026-07-21","chambre":"AN","legislature":"17","date":"2026-07-21","url":"instantanes/an17-2026-07-21.json","empreinte_sha256":"bd779f40b475e91c8336a54972dfb7ec8b960473b22cae9b0197d59214d40ead","octets":5902,"bandes":13}],"preuves":{"racine":"preuves/","eclats":256,"fonction":"deux premiers caractères hexadécimaux de l'id"}}
